{
  "$schema": "https://json-schema.org/draft/2020-12/schema",
  "$id": "urn:vega:schema:vega.skill-candidate-profile.v1",
  "title": "Vega Skill Candidate Profile v1",
  "description": "Tracked Vega profile that compiles curated repository evidence into a deterministic Core-X skill candidate.",
  "type": "object",
  "required": [
    "schema_version",
    "profile_id",
    "source",
    "candidate",
    "policy"
  ],
  "properties": {
    "schema_version": {
      "type": "string",
      "const": "vega.skill-candidate-profile.v1"
    },
    "profile_id": {
      "type": "string",
      "pattern": "^[a-z0-9][a-z0-9-]*[a-z0-9]$"
    },
    "source": {
      "type": "object",
      "required": ["repository", "commit"],
      "properties": {
        "repository": {
          "type": "string",
          "pattern": "^[A-Za-z0-9_.-]+/[A-Za-z0-9_.-]+$"
        },
        "commit": {
          "type": "string",
          "pattern": "^[a-f0-9]{40}$"
        }
      },
      "additionalProperties": false
    },
    "candidate": {
      "type": "object",
      "required": [
        "suggested_skill_id",
        "name",
        "description",
        "lane",
        "scope",
        "runtime"
      ],
      "properties": {
        "suggested_skill_id": {
          "type": "string",
          "pattern": "^[a-z0-9][a-z0-9-]*[a-z0-9]$"
        },
        "name": {
          "type": "string",
          "minLength": 1
        },
        "description": {
          "type": "string",
          "minLength": 1
        },
        "lane": {
          "type": "string",
          "enum": [
            "visual-runtime",
            "agent-workflows",
            "research-intelligence",
            "frontend-ui",
            "developer-tooling",
            "core-capability"
          ]
        },
        "scope": {
          "type": "string",
          "enum": ["house-local", "shared"]
        },
        "runtime": {
          "type": "string",
          "enum": ["markdown-prompt", "contract-only", "review-dossier"]
        },
        "required_tools_services": {
          "$ref": "#/$defs/tools_services"
        },
        "compatibility_assumptions": {
          "type": "array",
          "items": {
            "type": "string",
            "minLength": 1
          }
        },
        "evidence_summary": {
          "type": "string",
          "minLength": 1
        },
        "duplicate_matches": {
          "type": "array",
          "items": {
            "$ref": "#/$defs/duplicate_match"
          }
        },
        "conflict_findings": {
          "type": "array",
          "items": {
            "$ref": "#/$defs/finding"
          }
        },
        "risk_findings": {
          "type": "array",
          "items": {
            "$ref": "#/$defs/finding"
          }
        }
      },
      "additionalProperties": false
    },
    "policy": {
      "$ref": "#/$defs/policy"
    }
  },
  "$defs": {
    "string_list": {
      "type": "array",
      "items": {
        "type": "string",
        "minLength": 1
      },
      "minItems": 1
    },
    "tools_services": {
      "type": "object",
      "required": ["tools", "services"],
      "properties": {
        "tools": {
          "type": "array",
          "items": {
            "type": "string",
            "minLength": 1
          }
        },
        "services": {
          "type": "array",
          "items": {
            "type": "string",
            "minLength": 1
          }
        }
      },
      "additionalProperties": false
    },
    "policy": {
      "type": "object",
      "required": [
        "purpose",
        "when_to_use",
        "when_not_to_use",
        "relationship_to_vega",
        "safe_evaluation_workflow",
        "immutable_provenance_requirements",
        "license_requirements",
        "local_first_policy",
        "network_restrictions",
        "credential_restrictions",
        "human_approval_gates",
        "allowed_outputs",
        "failure_conditions",
        "prohibited_actions",
        "source_attribution"
      ],
      "properties": {
        "purpose": {
          "type": "string",
          "minLength": 1
        },
        "when_to_use": {
          "$ref": "#/$defs/string_list"
        },
        "when_not_to_use": {
          "$ref": "#/$defs/string_list"
        },
        "relationship_to_vega": {
          "type": "string",
          "minLength": 1
        },
        "safe_evaluation_workflow": {
          "$ref": "#/$defs/string_list"
        },
        "immutable_provenance_requirements": {
          "$ref": "#/$defs/string_list"
        },
        "license_requirements": {
          "$ref": "#/$defs/string_list"
        },
        "local_first_policy": {
          "type": "string",
          "minLength": 1
        },
        "network_restrictions": {
          "$ref": "#/$defs/string_list"
        },
        "credential_restrictions": {
          "$ref": "#/$defs/string_list"
        },
        "human_approval_gates": {
          "$ref": "#/$defs/string_list"
        },
        "allowed_outputs": {
          "$ref": "#/$defs/string_list"
        },
        "failure_conditions": {
          "$ref": "#/$defs/string_list"
        },
        "prohibited_actions": {
          "$ref": "#/$defs/string_list"
        },
        "source_attribution": {
          "$ref": "#/$defs/string_list"
        }
      },
      "additionalProperties": false
    },
    "duplicate_match": {
      "type": "object",
      "required": ["kind", "target", "confidence", "source"],
      "properties": {
        "kind": {
          "type": "string",
          "minLength": 1
        },
        "target": {
          "type": "string",
          "minLength": 1
        },
        "label": {
          "type": "string"
        },
        "confidence": {
          "type": "number",
          "minimum": 0,
          "maximum": 1
        },
        "source": {
          "type": "string",
          "minLength": 1
        }
      },
      "additionalProperties": false
    },
    "finding": {
      "type": "object",
      "required": ["kind", "severity", "summary"],
      "properties": {
        "kind": {
          "type": "string",
          "minLength": 1
        },
        "severity": {
          "type": "string",
          "enum": ["info", "warning", "blocking"]
        },
        "summary": {
          "type": "string",
          "minLength": 1
        },
        "source_refs": {
          "type": "array",
          "items": {
            "type": "string"
          }
        }
      },
      "additionalProperties": false
    }
  },
  "additionalProperties": false
}
